[
  {
    "id": "GO2026-001",
    "title": "Green Office 2026 Initiative Plan",
    "description": "Strategic plan for the Green Office 2026 initiative at Maejo University, outlining sustainability goals and action items.",
    "category": "strategic-plan",
    "subcategory": "initiative",
    "year": 2025,
    "fiscal_year": "2568",
    "version": "1.2",
    "status": "approved",
    "owner": "owner-sustainability",
    "department": "Office of Sustainability",
    "keywords": ["green office", "sustainability", "strategic plan", "MJU", "environment"],
    "tags": ["green-office", "strategic", "approved"],
    "language": "th",
    "file_type": "pdf",
    "file_size": 2450000,
    "storage_provider": "sharepoint",
    "storage_path": "/sites/GreenOffice/Shared Documents/Plans/GO2026_Initiative_Plan_v1.2.pdf",
    "share_url": "https://mju365.sharepoint.com/sites/GreenOffice/Shared%20Documents/Plans/GO2026_Initiative_Plan_v1.2.pdf",
    "preview_url": "",
    "thumbnail_url": "",
    "project_refs": ["green-office-2026"],
    "evidence_refs": ["ev-go-strategy"],
    "related_documents": ["GO2026-002", "GO2026-003"],
    "visibility": "internal",
    "created_at": "2025-06-01T08:00:00Z",
    "updated_at": "2026-03-15T10:30:00Z"
  },
  {
    "id": "GO2026-002",
    "title": "Waste Management Guidelines 2026",
    "description": "Standard operating procedures for waste segregation, collection, and disposal across MJU campuses.",
    "category": "guideline",
    "subcategory": "waste",
    "year": 2026,
    "fiscal_year": "2569",
    "version": "1.0",
    "status": "published",
    "owner": "owner-sustainability",
    "department": "Office of Sustainability",
    "keywords": ["waste management", "recycling", "guidelines", "MJU", "segregation"],
    "tags": ["waste", "guideline", "published"],
    "language": "th",
    "file_type": "docx",
    "file_size": 1800000,
    "storage_provider": "sharepoint",
    "storage_path": "/sites/GreenOffice/Shared Documents/Guidelines/Waste_Management_Guidelines_2026.docx",
    "share_url": "https://mju365.sharepoint.com/sites/GreenOffice/Shared%20Documents/Guidelines/Waste_Management_Guidelines_2026.docx",
    "preview_url": "",
    "thumbnail_url": "",
    "project_refs": ["green-office-2026"],
    "evidence_refs": [],
    "related_documents": ["GO2026-001"],
    "visibility": "internal",
    "created_at": "2026-01-10T09:00:00Z",
    "updated_at": "2026-01-10T09:00:00Z"
  },
  {
    "id": "GO2026-003",
    "title": "Green Office Quarterly Report Q1 2026",
    "description": "First quarter progress report for the Green Office 2026 initiative, including KPIs and milestones achieved.",
    "category": "report",
    "subcategory": "quarterly",
    "year": 2026,
    "fiscal_year": "2569",
    "version": "1.0",
    "status": "published",
    "owner": "owner-sustainability",
    "department": "Office of Sustainability",
    "keywords": ["quarterly report", "green office", "progress", "KPI", "Q1"],
    "tags": ["report", "quarterly", "published", "kpi"],
    "language": "th",
    "file_type": "pdf",
    "file_size": 3200000,
    "storage_provider": "sharepoint",
    "storage_path": "/sites/GreenOffice/Shared Documents/Reports/Q1_2026_Green_Office_Report.pdf",
    "share_url": "https://mju365.sharepoint.com/sites/GreenOffice/Shared%20Documents/Reports/Q1_2026_Green_Office_Report.pdf",
    "preview_url": "",
    "thumbnail_url": "",
    "project_refs": ["green-office-2026", "rae-landing"],
    "evidence_refs": ["ev-go-progress"],
    "related_documents": ["GO2026-001"],
    "visibility": "public",
    "created_at": "2026-04-05T14:00:00Z",
    "updated_at": "2026-04-05T14:00:00Z"
  },
  {
    "id": "RAE-001",
    "title": "RAE Assessment Preparation Guide",
    "description": "Comprehensive guide for faculty preparing documentation for the Research Assessment Exercise (RAE).",
    "category": "guideline",
    "subcategory": "assessment",
    "year": 2025,
    "fiscal_year": "2568",
    "version": "2.1",
    "status": "approved",
    "owner": "owner-research",
    "department": "Research Administration",
    "keywords": ["RAE", "assessment", "research", "preparation", "faculty guide"],
    "tags": ["rae", "guideline", "assessment", "research"],
    "language": "th",
    "file_type": "pdf",
    "file_size": 4100000,
    "storage_provider": "sharepoint",
    "storage_path": "/sites/ResearchOffice/Shared Documents/RAE/RAE_Assessment_Guide_v2.1.pdf",
    "share_url": "https://mju365.sharepoint.com/sites/ResearchOffice/Shared%20Documents/RAE/RAE_Assessment_Guide_v2.1.pdf",
    "preview_url": "",
    "thumbnail_url": "",
    "project_refs": ["rae-landing", "research-portal"],
    "evidence_refs": ["ev-rae-guidance"],
    "related_documents": ["RAE-002"],
    "visibility": "public",
    "created_at": "2025-03-01T08:00:00Z",
    "updated_at": "2026-02-20T11:00:00Z"
  },
  {
    "id": "RAE-002",
    "title": "RAE Evidence Submission Template",
    "description": "Standardized template for submitting evidence documents for the Research Assessment Exercise.",
    "category": "template",
    "subcategory": "evidence",
    "year": 2025,
    "fiscal_year": "2568",
    "version": "1.3",
    "status": "published",
    "owner": "owner-research",
    "department": "Research Administration",
    "keywords": ["RAE", "template", "evidence", "submission", "form"],
    "tags": ["rae", "template", "evidence", "submission"],
    "language": "en",
    "file_type": "xlsx",
    "file_size": 980000,
    "storage_provider": "onedrive",
    "storage_path": "/research/RAE/Templates/RAE_Evidence_Template_v1.3.xlsx",
    "share_url": "https://mju365-my.sharepoint.com/personal/research_mju365_onmicrosoft_com/Documents/RAE/Templates/RAE_Evidence_Template_v1.3.xlsx",
    "preview_url": "",
    "thumbnail_url": "",
    "project_refs": ["rae-landing", "research-portal"],
    "evidence_refs": ["ev-rae-submission"],
    "related_documents": ["RAE-001"],
    "visibility": "public",
    "created_at": "2025-04-15T10:00:00Z",
    "updated_at": "2026-01-25T15:30:00Z"
  },
  {
    "id": "LC-001",
    "title": "Learning Center Course Catalog 2026",
    "description": "Complete catalog of courses and workshops offered by the MJU Learning Center for the 2026 academic year.",
    "category": "catalog",
    "subcategory": "course",
    "year": 2026,
    "fiscal_year": "2569",
    "version": "1.0",
    "status": "published",
    "owner": "owner-learning",
    "department": "Learning Center",
    "keywords": ["learning center", "course catalog", "workshops", "training", "MJU"],
    "tags": ["learning", "catalog", "courses", "2026"],
    "language": "th",
    "file_type": "pdf",
    "file_size": 5600000,
    "storage_provider": "sharepoint",
    "storage_path": "/sites/LearningCenter/Shared Documents/Catalog/Course_Catalog_2026.pdf",
    "share_url": "https://mju365.sharepoint.com/sites/LearningCenter/Shared%20Documents/Catalog/Course_Catalog_2026.pdf",
    "preview_url": "",
    "thumbnail_url": "",
    "project_refs": ["learning-center"],
    "evidence_refs": ["ev-lc-catalog"],
    "related_documents": ["LC-002"],
    "visibility": "public",
    "created_at": "2026-05-01T08:00:00Z",
    "updated_at": "2026-05-15T09:00:00Z"
  },
  {
    "id": "LC-002",
    "title": "Learning Center Annual Report 2025",
    "description": "Annual performance report for the MJU Learning Center covering activities, enrollment, and outcomes for 2025.",
    "category": "report",
    "subcategory": "annual",
    "year": 2025,
    "fiscal_year": "2568",
    "version": "1.0",
    "status": "published",
    "owner": "owner-learning",
    "department": "Learning Center",
    "keywords": ["annual report", "learning center", "performance", "enrollment", "2025"],
    "tags": ["report", "annual", "learning", "performance"],
    "language": "th",
    "file_type": "pdf",
    "file_size": 4200000,
    "storage_provider": "onedrive",
    "storage_path": "/learning/Reports/Annual_Report_2025.pdf",
    "share_url": "https://mju365-my.sharepoint.com/personal/learning_mju365_onmicrosoft_com/Documents/Reports/Annual_Report_2025.pdf",
    "preview_url": "",
    "thumbnail_url": "",
    "project_refs": ["learning-center"],
    "evidence_refs": ["ev-lc-performance"],
    "related_documents": [],
    "visibility": "public",
    "created_at": "2026-01-20T10:00:00Z",
    "updated_at": "2026-01-20T10:00:00Z"
  }
]
